{
  "schemaVersion": 2,
  "changeId": "v1.4-rc-promotion",
  "title": "v1.4 RC promotion readiness follow-up",
  "owner": "Provider Platform Working Group",
  "generatedAt": "2026-10-02T17:38:52.986Z",
  "checkpoint": "release",
  "comparison": {
    "base": null,
    "head": null
  },
  "changedFiles": [
    "cspell.json",
    "docs/evidence/changes/v1.4-rc-promotion/documentation/documentation-impact.json",
    "docs/evidence/changes/v1.4-rc-promotion/documentation/documentation-impact.md",
    "docs/evidence/changes/v1.4-rc-promotion/documentation/documentation-synchronization.md",
    "docs/evidence/changes/v1.4-rc-promotion/documentation/evidence-manifest.json",
    "docs/evidence/changes/v1.4-rc-promotion/documentation/migration-impact.md",
    "docs/evidence/changes/v1.4-rc-promotion/documentation/missing-documentation.md",
    "docs/evidence/changes/v1.4-rc-promotion/documentation/updated-documents.md"
  ],
  "changeProfile": "documentation",
  "affectedComponents": [],
  "implementationFiles": [],
  "documentationFiles": [
    "docs/evidence/changes/v1.4-rc-promotion/documentation/documentation-impact.json",
    "docs/evidence/changes/v1.4-rc-promotion/documentation/documentation-impact.md",
    "docs/evidence/changes/v1.4-rc-promotion/documentation/documentation-synchronization.md",
    "docs/evidence/changes/v1.4-rc-promotion/documentation/evidence-manifest.json",
    "docs/evidence/changes/v1.4-rc-promotion/documentation/migration-impact.md",
    "docs/evidence/changes/v1.4-rc-promotion/documentation/missing-documentation.md",
    "docs/evidence/changes/v1.4-rc-promotion/documentation/updated-documents.md"
  ],
  "testFiles": [],
  "requirements": [],
  "blockers": [],
  "decision": "ready"
}
