{
  "schemaVersion": 2,
  "changeId": "credential-slots-cli-dashboard",
  "title": "Provider credential slot CLI and documentation synchronization",
  "owner": "Forgevena maintainers",
  "generatedAt": "2026-10-02T15:25:49.622Z",
  "checkpoint": "merge",
  "comparison": {
    "base": null,
    "head": null
  },
  "changedFiles": [
    ".github/workflows/package-validation.yml",
    "cspell.json",
    "docs/CLI.md",
    "docs/PROVIDER_CONFIGURATION.md",
    "docs/cli/reference.md",
    "docs/configuration/reference.md",
    "docs/examples/executable-evidence.json",
    "docs/operations/runbooks.md",
    "docs/providers/adapter-contract.md",
    "docs/providers/reference.md",
    "docs/reference/generated/ai-documentation-index.json",
    "docs/reference/generated/cli.md",
    "docs/reference/generated/documentation-catalog.json",
    "docs/reference/generated/documentation-coverage-matrix.md",
    "docs/reference/generated/documentation-health.json",
    "docs/reference/generated/documentation-health.md",
    "docs/reference/generated/manifest.json",
    "docs/release/V1_4_IMPLEMENTATION_STATUS.md",
    "docs/release/V1_4_RELEASE_CHECKLIST.md",
    "docs/schemas/index.md",
    "docs/security/guide.md",
    "src/cli.js",
    "src/cli/handlers/foundation.js",
    "src/documentation-generator.js",
    "test/cli-foundation-handlers.test.js",
    "test/cli-help.test.js",
    "test/config-transfer.test.js",
    "test/credentials.test.js",
    "test/dashboard.test.js",
    "test/public-contract-branches.test.js",
    "test/release-completion-evidence.test.js",
    "test/release.test.js"
  ],
  "changeProfile": "implementation",
  "affectedComponents": [
    "build-testing-and-dependencies",
    "cli",
    "cloud-infrastructure-and-deployment",
    "governance-and-policy"
  ],
  "implementationFiles": [
    ".github/workflows/package-validation.yml",
    "src/cli.js",
    "src/cli/handlers/foundation.js",
    "src/documentation-generator.js"
  ],
  "documentationFiles": [
    "docs/CLI.md",
    "docs/PROVIDER_CONFIGURATION.md",
    "docs/cli/reference.md",
    "docs/configuration/reference.md",
    "docs/examples/executable-evidence.json",
    "docs/operations/runbooks.md",
    "docs/providers/adapter-contract.md",
    "docs/providers/reference.md",
    "docs/reference/generated/ai-documentation-index.json",
    "docs/reference/generated/cli.md",
    "docs/reference/generated/documentation-catalog.json",
    "docs/reference/generated/documentation-coverage-matrix.md",
    "docs/reference/generated/documentation-health.json",
    "docs/reference/generated/documentation-health.md",
    "docs/reference/generated/manifest.json",
    "docs/release/V1_4_IMPLEMENTATION_STATUS.md",
    "docs/release/V1_4_RELEASE_CHECKLIST.md",
    "docs/schemas/index.md",
    "docs/security/guide.md"
  ],
  "testFiles": [
    "test/cli-foundation-handlers.test.js",
    "test/cli-help.test.js",
    "test/config-transfer.test.js",
    "test/credentials.test.js",
    "test/dashboard.test.js",
    "test/public-contract-branches.test.js",
    "test/release-completion-evidence.test.js",
    "test/release.test.js"
  ],
  "requirements": [
    {
      "id": "cli-generated-reference",
      "component": "cli",
      "criticality": "important",
      "reason": "cli changes require synchronized cli generated reference.",
      "candidateDocuments": [
        "docs/reference/generated/cli.md"
      ],
      "matchedDocuments": [
        "docs/reference/generated/cli.md"
      ],
      "status": "pass",
      "mandatory": true
    },
    {
      "id": "cli-user-reference",
      "component": "cli",
      "criticality": "important",
      "reason": "cli changes require synchronized cli user reference.",
      "candidateDocuments": [
        "docs/cli/reference.md",
        "README.md"
      ],
      "matchedDocuments": [
        "docs/cli/reference.md"
      ],
      "status": "pass",
      "mandatory": true
    },
    {
      "id": "constitutional-alignment",
      "component": "governance-and-policy",
      "criticality": "critical",
      "reason": "governance-and-policy changes require synchronized constitutional alignment.",
      "candidateDocuments": [
        "docs/strategy/PLATFORM_CONSTITUTION.md"
      ],
      "matchedDocuments": [],
      "status": "not-applicable",
      "mandatory": true,
      "rationale": "No constitutional invariant changed; implementation and privacy constraints remain unchanged."
    },
    {
      "id": "deployment-guidance",
      "component": "cloud-infrastructure-and-deployment",
      "criticality": "important",
      "reason": "cloud-infrastructure-and-deployment changes require synchronized deployment guidance.",
      "candidateDocuments": [
        "docs/deployment/",
        "docs/release/"
      ],
      "matchedDocuments": [
        "docs/release/V1_4_IMPLEMENTATION_STATUS.md",
        "docs/release/V1_4_RELEASE_CHECKLIST.md"
      ],
      "status": "pass",
      "mandatory": true
    },
    {
      "id": "documentation-governance",
      "component": "governance-and-policy",
      "criticality": "critical",
      "reason": "governance-and-policy changes require synchronized documentation governance.",
      "candidateDocuments": [
        "docs/governance/"
      ],
      "matchedDocuments": [],
      "status": "not-applicable",
      "mandatory": true,
      "rationale": "No documentation-governance policy changed; required user and operator documentation is updated."
    },
    {
      "id": "engineering-governance",
      "component": "governance-and-policy",
      "criticality": "critical",
      "reason": "governance-and-policy changes require synchronized engineering governance.",
      "candidateDocuments": [
        "docs/ENGINEERING_GOVERNANCE.md"
      ],
      "matchedDocuments": [],
      "status": "not-applicable",
      "mandatory": true,
      "rationale": "No engineering-governance policy or architecture authority changed."
    },
    {
      "id": "implementation-documentation-coupling",
      "component": "cross-cutting",
      "criticality": "critical",
      "reason": "Implementation changes require documentation in the same change.",
      "candidateDocuments": [
        "docs/",
        "README.md",
        "CHANGELOG.md",
        "SECURITY.md",
        "SUPPORTED_VERSIONS.md",
        "CONTRIBUTING.md",
        "GOVERNANCE.md",
        "ROADMAP.md",
        "RELEASE.md",
        "AGENTS.md"
      ],
      "matchedDocuments": [
        "docs/CLI.md",
        "docs/PROVIDER_CONFIGURATION.md",
        "docs/cli/reference.md",
        "docs/configuration/reference.md",
        "docs/examples/executable-evidence.json",
        "docs/operations/runbooks.md",
        "docs/providers/adapter-contract.md",
        "docs/providers/reference.md",
        "docs/reference/generated/ai-documentation-index.json",
        "docs/reference/generated/cli.md",
        "docs/reference/generated/documentation-catalog.json",
        "docs/reference/generated/documentation-coverage-matrix.md",
        "docs/reference/generated/documentation-health.json",
        "docs/reference/generated/documentation-health.md",
        "docs/reference/generated/manifest.json",
        "docs/release/V1_4_IMPLEMENTATION_STATUS.md",
        "docs/release/V1_4_RELEASE_CHECKLIST.md",
        "docs/schemas/index.md",
        "docs/security/guide.md"
      ],
      "status": "pass",
      "mandatory": true
    },
    {
      "id": "implementation-test-coupling",
      "component": "cross-cutting",
      "criticality": "important",
      "reason": "Implementation changes require executable validation or a governed not-applicable rationale.",
      "candidateDocuments": [
        "test/"
      ],
      "matchedDocuments": [
        "test/cli-foundation-handlers.test.js",
        "test/cli-help.test.js",
        "test/config-transfer.test.js",
        "test/credentials.test.js",
        "test/dashboard.test.js",
        "test/public-contract-branches.test.js",
        "test/release-completion-evidence.test.js",
        "test/release.test.js"
      ],
      "status": "pass",
      "mandatory": true
    },
    {
      "id": "operations-and-rollback",
      "component": "cloud-infrastructure-and-deployment",
      "criticality": "critical",
      "reason": "cloud-infrastructure-and-deployment changes require synchronized operations and rollback.",
      "candidateDocuments": [
        "docs/operations/",
        "docs/runbooks/"
      ],
      "matchedDocuments": [
        "docs/operations/runbooks.md"
      ],
      "status": "pass",
      "mandatory": true
    },
    {
      "id": "testing-build-guidance",
      "component": "build-testing-and-dependencies",
      "criticality": "important",
      "reason": "build-testing-and-dependencies changes require synchronized testing build guidance.",
      "candidateDocuments": [
        "docs/testing/",
        "docs/release/"
      ],
      "matchedDocuments": [
        "docs/release/V1_4_IMPLEMENTATION_STATUS.md",
        "docs/release/V1_4_RELEASE_CHECKLIST.md"
      ],
      "status": "pass",
      "mandatory": true
    }
  ],
  "blockers": [],
  "decision": "ready"
}
